{
  "schemaVersion": 1,
  "taskId": "nlp-retrieval",
  "corpusId": "corpus-retrieval-licensed-news",
  "formula": "bm25f.k1-1.2.b-0.75.fielded",
  "k": 3,
  "relevantGradeThreshold": 1,
  "tolerance": 1e-12,
  "summary": {
    "precisionAtK": 0.3888888888888889,
    "recallAtK": 0.8333333333333334,
    "mrr": 0.8333333333333334,
    "ndcgAtK": 0.8333333333333334
  },
  "queries": [
    {
      "queryId": "licensed-ar-heritage",
      "retrieved": ["doc-ar-heritage"],
      "relevant": ["doc-ar-heritage"],
      "precisionAtK": 0.3333333333333333,
      "recallAtK": 1,
      "reciprocalRank": 1,
      "ndcgAtK": 1
    },
    {
      "queryId": "licensed-climate-policy",
      "retrieved": ["doc-climate-1", "doc-climate-2"],
      "relevant": ["doc-climate-1", "doc-climate-2"],
      "precisionAtK": 0.6666666666666666,
      "recallAtK": 1,
      "reciprocalRank": 1,
      "ndcgAtK": 1
    },
    {
      "queryId": "licensed-es-archive",
      "retrieved": ["doc-es-archive"],
      "relevant": ["doc-es-archive"],
      "precisionAtK": 0.3333333333333333,
      "recallAtK": 1,
      "reciprocalRank": 1,
      "ndcgAtK": 1
    },
    {
      "queryId": "licensed-health-privacy",
      "retrieved": ["doc-health-2", "doc-health-1"],
      "relevant": ["doc-health-1", "doc-health-2"],
      "precisionAtK": 0.6666666666666666,
      "recallAtK": 1,
      "reciprocalRank": 1,
      "ndcgAtK": 1
    },
    {
      "queryId": "licensed-no-hit-control",
      "retrieved": [],
      "relevant": [],
      "precisionAtK": 0,
      "recallAtK": 0,
      "reciprocalRank": 0,
      "ndcgAtK": 0
    },
    {
      "queryId": "licensed-search-relevance",
      "retrieved": ["doc-tech-1"],
      "relevant": ["doc-tech-1"],
      "precisionAtK": 0.3333333333333333,
      "recallAtK": 1,
      "reciprocalRank": 1,
      "ndcgAtK": 1
    }
  ]
}
